MCQ,Choices,Correct
What is deep learning?,a: A type of machine learning that uses artificial neural networks to learn from data. | b: A type of machine learning that uses decision trees to make predictions. | c: A type of machine learning that uses rule-based systems to make decisions. | d: A type of machine learning that uses linear regression to make predictions.,A type of machine learning that uses artificial neural networks to learn from data.
Which of the following is not a type of deep learning model?,a: Convolutional neural network (CNN) | b: Recurrent neural network (RNN) | c: Deep reinforcement learning | d: Support vector machine (SVM),Support vector machine (SVM)
What is overfitting in deep learning?,a: When a model learns the underlying relationship between features. | b: When a model learns the noise in the data rather than the underlying relationships. | c: When a model learns too quickly. | d: When a model does not learn at all.,When a model learns the noise in the data rather than the underlying relationships.
Which of the following is a benefit of using deep learning models?,a: Can learn complex relationships between features in data. | b: Does not require a large dataset to learn from. | c: Does not require human intervention to train. | d: Can be used for any type of machine learning task.,Can learn complex relationships between features in data.
Which of the following is not a challenge of using deep learning models?,a: Can be prone to overfitting. | b: Does not require a large dataset to learn from. | c: Does not require human intervention to train. | d: Can be used for any type of machine learning task.,Does not require a large dataset to learn from.
